{
  "$schema": "../schemas/ksrf_filing/capability-manifest.setup-or-matter.v1.json",
  "schema_version": "1.0.0",
  "manifest_id": "ksrf-filing-capabilities-v1",
  "initial_state": "skills_only",
  "safety": {
    "external_transmission_default": false,
    "automatic_installation": false,
    "automatic_account_creation": false,
    "secret_values_reported": false,
    "network_requires_explicit_authorization": true
  },
  "profiles": {
    "basic": {
      "title": "Базовый",
      "purpose": "Локально принять материалы дела, проверить официальные источники, оценить допустимость и собрать проверяемый комплект DOCX/PDF."
    },
    "research": {
      "title": "Исследовательский",
      "purpose": "Добавить необязательные каналы поиска, историю редакций, ЕСПЧ, полнотекстовый поиск и проекции для расширения покрытия."
    },
    "expert": {
      "title": "Экспертный",
      "purpose": "Добавить изолированный корпус неудачных обращений, трассировку, оценки без знания последующего исхода и обязательную именную проверку человеком."
    }
  },
  "capabilities": [
    {
      "id": "local_matter_storage",
      "title": "Локальное хранилище дела",
      "purpose": "Хранить исходные документы и доказательственные артефакты внутри выбранной рабочей папки.",
      "privacy": "Материалы остаются на компьютере пользователя; проверка ничего не создаёт.",
      "cost": "Без оплаты.",
      "dependency": "Без доступной локальной папки нельзя безопасно зарегистрировать материалы дела.",
      "remediation": "Выберите отдельную доступную для чтения и записи локальную папку и повторите проверку.",
      "profiles": {"basic": "required", "research": "required", "expert": "required"},
      "dependent_gates": ["matter_init", "intake"],
      "blocking_when_missing": true,
      "probe": {"kind": "directory", "path": ".", "write_required": true}
    },
    {
      "id": "local_analysis_runtime",
      "title": "Локальный аналитический контур",
      "purpose": "Запускать детерминированные проверки допустимости и конституционно-правовой проблемы.",
      "privacy": "Выполняется локально и не передаёт тексты дела.",
      "cost": "Без оплаты.",
      "dependency": "Нужен для локального анализа и проверки контрактов.",
      "remediation": "Укажите доступный локальный Python 3; установка автоматически не выполняется.",
      "profiles": {"basic": "required", "research": "required", "expert": "required"},
      "dependent_gates": ["admissibility", "constitutional_issue"],
      "blocking_when_missing": true,
      "probe": {"kind": "executable", "executables": ["python3", "python"]}
    },
    {
      "id": "filing_python_libraries",
      "title": "Python-библиотеки для сборки и проверки файлов",
      "purpose": "Создавать реальный DOCX, читать PDF и проверять визуальные превью локально.",
      "privacy": "Библиотеки работают локально и не передают материалы дела наружу.",
      "cost": "Без обязательной оплаты.",
      "dependency": "Без python-docx, pypdf и Pillow нельзя подтвердить сборку и проверку реальных файлов жалобы.",
      "remediation": "Установите в выбранное локальное Python-окружение пакеты python-docx, pypdf и Pillow, затем повторите doctor; автоматическая установка не выполняется.",
      "profiles": {"basic": "required", "research": "required", "expert": "required"},
      "dependent_gates": ["draft_render", "pdf_release", "visual_qa"],
      "blocking_when_missing": true,
      "probe": {"kind": "python_module", "modules": ["docx", "pypdf", "PIL"]}
    },
    {
      "id": "document_text_extraction",
      "title": "Извлечение текста из документов",
      "purpose": "Извлекать текст из PDF без отправки документа внешнему сервису.",
      "privacy": "Локальная обработка.",
      "cost": "Без оплаты.",
      "dependency": "Без извлечённого текста нельзя надёжно привязать выводы к страницам и фрагментам акта.",
      "remediation": "Настройте локальный извлекатель PDF, например pdftotext или pypdf, и повторите проверку.",
      "profiles": {"basic": "required", "research": "required", "expert": "required"},
      "dependent_gates": ["intake", "source_evidence"],
      "blocking_when_missing": true,
      "probe": {
        "kind": "any_of",
        "alternatives": [
          {"kind": "executable", "executables": ["pdftotext"]},
          {"kind": "python_module", "modules": ["pypdf"]}
        ]
      }
    },
    {
      "id": "local_ocr",
      "title": "Локальное распознавание сканов",
      "purpose": "Распознавать отсканированные судебные акты, если в PDF нет текстового слоя.",
      "privacy": "Изображения и текст остаются локально.",
      "cost": "Без оплаты.",
      "dependency": "Скан без распознанного текста не может подтверждать применение нормы по точному фрагменту.",
      "remediation": "Сначала настройте локальный OCR-контур (OCRmyPDF или Tesseract); удалённую передачу документа не включайте без отдельного согласия.",
      "profiles": {"basic": "required", "research": "required", "expert": "required"},
      "dependent_gates": ["intake", "application_evidence"],
      "blocking_when_missing": true,
      "probe": {"kind": "ocr", "executables": ["ocrmypdf", "tesseract"]}
    },
    {
      "id": "official_source_browser",
      "title": "Браузер для официальных источников",
      "purpose": "Открывать официальные страницы и выполнять ручную проверку при CAPTCHA или интерактивном доступе.",
      "privacy": "Браузерный переход раскрывает источнику обычные сетевые метаданные, но материалы дела не передаются автоматически.",
      "cost": "Без обязательной оплаты.",
      "dependency": "Нужен для проверки официального якоря, когда прямой запрос невозможен.",
      "remediation": "Укажите установленный Chrome/Chromium или используйте ручной импорт официального файла.",
      "profiles": {"basic": "required", "research": "required", "expert": "required"},
      "dependent_gates": ["official_source_verification", "norm_version"],
      "blocking_when_missing": true,
      "probe": {
        "kind": "browser",
        "executables": ["chromium", "chromium-browser", "google-chrome", "google-chrome-stable"],
        "paths": [
          "/Applications/Google Chrome.app/Contents/MacOS/Google Chrome",
          "/Applications/Chromium.app/Contents/MacOS/Chromium"
        ]
      }
    },
    {
      "id": "official_ksrf_access",
      "title": "Доступ к официальному сайту КС РФ",
      "purpose": "Проверить техническую доступность официального источника актов КС РФ.",
      "privacy": "Проверка отправляет только ограниченный технический запрос без текста дела и запускается лишь с явным разрешением.",
      "cost": "Без оплаты.",
      "dependency": "Недоступность источника оставляет проверку официального акта незавершённой, но не доказывает отсутствие акта.",
      "remediation": "Разрешите ограниченную сетевую проверку либо вручную импортируйте официальный файл с адресом и датой получения.",
      "profiles": {"basic": "optional", "research": "optional", "expert": "optional"},
      "dependent_gates": ["official_source_verification"],
      "blocking_when_missing": false,
      "probe": {"kind": "bounded_network", "url": "https://ksrf.ru/", "timeout_seconds": 3}
    },
    {
      "id": "docx_generation",
      "title": "Сборка редактируемого документа",
      "purpose": "Подготовить локальный редактируемый артефакт жалобы до экспертной проверки.",
      "privacy": "Сборка выполняется локально.",
      "cost": "Без обязательной оплаты.",
      "dependency": "Нужен для воспроизводимой сборки жалобы и описи приложений.",
      "remediation": "Настройте объявленный локальный контур генерации DOCX и повторите проверку выпуска.",
      "profiles": {"basic": "required", "research": "required", "expert": "required"},
      "dependent_gates": ["draft_render"],
      "blocking_when_missing": true,
      "probe": {"kind": "executable", "executables": ["python3", "python"]}
    },
    {
      "id": "pdf_renderer",
      "title": "Локальный рендерер PDF",
      "purpose": "Преобразовать DOCX в PDF заявленным воспроизводимым инструментом.",
      "privacy": "Документ остаётся локально.",
      "cost": "Без обязательной оплаты.",
      "dependency": "Без фактического PDF нельзя считать комплект готовым к проверке или подаче.",
      "remediation": "Настройте локальный LibreOffice/soffice или другой объявленный рендерер и повторите выпуск.",
      "profiles": {"basic": "required", "research": "required", "expert": "required"},
      "dependent_gates": ["pdf_release"],
      "blocking_when_missing": true,
      "probe": {
        "kind": "renderer",
        "executables": ["soffice", "libreoffice"],
        "paths": ["/Applications/LibreOffice.app/Contents/MacOS/soffice"]
      }
    },
    {
      "id": "pdf_visual_qa",
      "title": "Локальная визуальная проверка PDF",
      "purpose": "Рендерить страницы для проверки обрезки, пустых страниц, таблиц и нумерации.",
      "privacy": "Страницы остаются локально.",
      "cost": "Без оплаты.",
      "dependency": "Без визуальной проверки нельзя исключить материальные дефекты итогового файла.",
      "remediation": "Настройте локальный рендерер страниц PDF, например pdftoppm, и повторите проверку.",
      "profiles": {"basic": "required", "research": "required", "expert": "required"},
      "dependent_gates": ["visual_qa", "release"],
      "blocking_when_missing": true,
      "probe": {"kind": "renderer", "executables": ["pdftoppm", "mutool"]}
    },
    {
      "id": "casus_discovery",
      "title": "Дополнительный поиск судебных материалов",
      "purpose": "Искать кандидатов и связанные дела в дополнительном правовом сервисе; найденное не становится официальным якорем автоматически.",
      "privacy": "Не передавайте текст частного дела без отдельного согласия; проверяется только наличие настройки доступа.",
      "cost": "Может требовать платную подписку.",
      "dependency": "Расширяет покрытие поиска, но не нужен для базовой проверки по официальным источникам.",